{"schema":"session/v4","run_id":"r","iteration":1,"phase":"second-review","agent":"claude","task":"T1","model":"sonnet","effort":null,"models_used":{"m":{"input_tokens":1,"output_tokens":2,"cache_read_input_tokens":3,"cache_creation_input_tokens":4,"cost_usd":0.5}},"started":"2026-01-01T09:00:00Z","ended":"2026-01-01T09:00:10Z","duration_ms":10,"wall_ms":10,"cost_usd":0.5,"cost_source":"reported","turns":1,"is_error":false,"permission_denials":[]}
